{
  "version": "3.2.0",
  "metro": "Southern California",
  "generatedAt": "2026-10-10",
  "organizations": [
    {
      "id": "yola",
      "name": "Youth Orchestra Los Angeles (YOLA)",
      "type": "youth",
      "lat": 33.9596,
      "lng": -118.3517,
      "area": "Inglewood",
      "metro": "Greater Los Angeles",
      "website": "https://www.laphil.com/learn/yola",
      "applyUrl": null,
      "blurb": "The LA Phil's free music program: instruments, instruction, and orchestras for young musicians aged 6–18 across five LA County sites, including the Beckmen YOLA Center in Inglewood.",
      "season": {
        "status": "unverified",
        "source": "https://www.laphil.com/learn/yola/youth-orchestra-los-angeles"
      },
      "ages": [
        6,
        18
      ],
      "instruments": [
        "Strings",
        "Winds",
        "Brass",
        "Percussion"
      ],
      "rehearsal": {
        "status": "unverified",
        "source": "https://www.laphil.com/learn/yola/youth-orchestra-los-angeles"
      },
      "commitment": {
        "status": "verified",
        "value": "Several hours per week, after school",
        "source": "https://heartofla.org/yola/",
        "asOf": "2026-06-22"
      },
      "financialAid": {
        "status": "unverified",
        "source": "https://www.laphil.com/learn/yola/youth-orchestra-los-angeles"
      },
      "tuition": {
        "status": "verified",
        "value": "Free — instruments and instruction provided",
        "source": "https://www.laphil.com/learn/yola",
        "asOf": "2026-06-22"
      },
      "goodFit": "Good fit if you want a free, high-support program and live near a YOLA site.",
      "reviews": null,
      "ensembles": [
        {
          "name": "Beginning Orchestra",
          "level": "Beginner",
          "ages": [
            6,
            10
          ],
          "desc": "First-instrument and early ensemble training; no experience needed."
        },
        {
          "name": "Intermediate Orchestra",
          "level": "Intermediate",
          "ages": [
            9,
            13
          ],
          "desc": "Full ensemble repertoire and sectionals."
        },
        {
          "name": "Advanced Orchestra",
          "level": "Advanced",
          "ages": [
            13,
            18
          ],
          "desc": "Flagship-level players; performances at the Hollywood Bowl and Walt Disney Concert Hall."
        }
      ],
      "performances": [],
      "auditions": [
        {
          "level": "Beginner",
          "instruments": "All — no experience required",
          "window": {
            "status": "unverified"
          },
          "status": "rolling",
          "ages": [
            6,
            10
          ],
          "note": "Start via the YOLA Interest Form; placement is by interview, not a formal audition. Space varies by site.",
          "source": "https://www.laphil.com/learn/yola"
        },
        {
          "level": "Advanced",
          "instruments": "Strings, winds, brass, percussion",
          "window": {
            "status": "unverified"
          },
          "status": "upcoming",
          "ages": [
            13,
            18
          ],
          "note": "Advanced placement is audition-based; check the site for the current window.",
          "source": "https://www.laphil.com/learn/yola"
        }
      ],
      "sources": [
        {
          "url": "https://www.laphil.com/learn/yola",
          "label": "LA Phil — YOLA",
          "retrievedAt": "2026-06-22"
        },
        {
          "url": "https://en.wikipedia.org/wiki/Youth_Orchestra_Los_Angeles",
          "label": "Wikipedia — YOLA",
          "retrievedAt": "2026-06-22"
        },
        {
          "url": "https://www.laphil.com/learn/yola/youth-orchestra-los-angeles",
          "label": "LA Phil — YOLA program & how to join",
          "retrievedAt": "2026-07-04"
        }
      ],
      "lastVerified": "2026-06-22",
      "listingStatus": "published",
      "provenanceType": "curated"
    },
    {
      "id": "colburn",
      "name": "Colburn Community School of Performing Arts — Youth Orchestras",
      "type": "youth",
      "lat": 34.0537,
      "lng": -118.2497,
      "area": "Downtown LA",
      "metro": "Greater Los Angeles",
      "website": "https://www.colburnschool.edu",
      "applyUrl": "https://colburnschool.edu/community-school/by-program/ensembles/",
      "blurb": "The Community School of Performing Arts at Colburn runs graded youth orchestras and a new advanced performance program feeding its renowned conservatory, in the Music Center district.",
      "season": {
        "status": "unverified",
        "source": "https://colburnschool.edu/community-school/by-program/ensembles/"
      },
      "ages": [
        8,
        18
      ],
      "instruments": [
        "Strings",
        "Winds",
        "Brass",
        "Percussion",
        "Harp"
      ],
      "rehearsal": {
        "status": "unverified",
        "source": "https://colburnschool.edu/community-school/by-program/ensembles/"
      },
      "commitment": {
        "status": "unverified",
        "source": "https://colburnschool.edu/community-school/by-program/ensembles/"
      },
      "financialAid": {
        "status": "verified",
        "value": true,
        "source": "https://colburnschool.edu/community-school/by-program/ensembles/",
        "asOf": "2026-06-22"
      },
      "tuition": {
        "status": "unverified",
        "source": "https://colburnschool.edu/community-school/register/"
      },
      "goodFit": "Good fit for a serious, conservatory-track student; scholarships help with cost.",
      "reviews": null,
      "ensembles": [
        {
          "name": "Violin / Cello Ensembles",
          "level": "Beginner",
          "ages": [
            6,
            12
          ],
          "desc": "Entry-level ensembles building reading and ensemble fundamentals."
        },
        {
          "name": "String Orchestra",
          "level": "Intermediate",
          "ages": [
            11,
            16
          ],
          "desc": "Intermediate/advanced strings; placement by audition."
        },
        {
          "name": "Colburn Youth Philharmonic",
          "level": "Advanced",
          "ages": [
            13,
            18
          ],
          "desc": "Top symphonic ensemble (replacing the Colburn Youth Orchestra for 2026–27)."
        },
        {
          "name": "Advanced Music Performance Program",
          "level": "Pre-professional",
          "ages": [
            13,
            18
          ],
          "desc": "Highly selective Sunday program: orchestra, chamber music, theory, college-audition prep."
        }
      ],
      "performances": [],
      "auditions": [
        {
          "level": "Intermediate",
          "instruments": "Strings",
          "window": {
            "status": "unverified"
          },
          "status": "rolling",
          "ages": [
            11,
            16
          ],
          "note": "By application + video prescreen, then live audition (most recent round was held June 6–7, 2026). Check the site for the next window.",
          "source": "https://colburnschool.edu/community-school/by-program/ensembles/string-orchestra/"
        },
        {
          "level": "Pre-professional",
          "instruments": "Piano, strings, winds, brass, percussion",
          "window": {
            "status": "unverified"
          },
          "status": "rolling",
          "ages": [
            13,
            18
          ],
          "note": "Advanced Music Performance Program — selective audition; one day a week (Sundays).",
          "source": "https://colburnschool.edu/community-school/by-program/advanced_music_program/"
        }
      ],
      "sources": [
        {
          "url": "https://www.colburnschool.edu",
          "label": "Colburn School",
          "retrievedAt": "2026-06-22"
        },
        {
          "url": "https://colburnschool.edu/community-school/by-program/ensembles/",
          "label": "Community School ensembles",
          "retrievedAt": "2026-06-22"
        },
        {
          "url": "https://colburnschool.edu/community-school/by-program/advanced_music_program/",
          "label": "Advanced Music Performance Program",
          "retrievedAt": "2026-06-22"
        },
        {
          "url": "https://colburnschool.edu/community-school/register/",
          "label": "Community School — registration & tuition",
          "retrievedAt": "2026-07-03"
        }
      ],
      "lastVerified": "2026-06-22",
      "listingStatus": "published",
      "provenanceType": "curated"
    },
    {
      "id": "layo",
      "name": "Los Angeles Youth Orchestra",
      "type": "youth",
      "lat": 34.1718,
      "lng": -118.5125,
      "area": "Encino",
      "metro": "Greater Los Angeles",
      "website": "https://losangelesyouthorchestra.org",
      "applyUrl": "https://losangelesyouthorchestra.org/audition-information/",
      "blurb": "A welcoming youth orchestra rehearsing Sunday afternoons in Encino, with an intermediate and an advanced ensemble and two concerts each semester.",
      "season": {
        "status": "verified",
        "value": "2026–27 season",
        "source": "https://losangelesyouthorchestra.org/audition-information/",
        "asOf": "2026-06-22"
      },
      "ages": [
        8,
        18
      ],
      "instruments": [
        "Strings",
        "Winds",
        "Brass",
        "Percussion"
      ],
      "rehearsal": {
        "status": "verified",
        "value": "Sunday afternoons, 1:30–5:00 PM (Encino)",
        "source": "https://losangelesyouthorchestra.org/audition-information/",
        "asOf": "2026-06-22"
      },
      "commitment": {
        "status": "verified",
        "value": "Weekly rehearsals; two fall and two spring concerts",